Message_id	room_id	Origin	Content	Type	Target	Additional
a8eb9ffd-a2b7-4c66-9ae5-f6850143ac8e	d87b4f85-b97a-466a-8c46-7f2958839af8	Hedgehog	but, what if 3 has a vowel on the back?	Probing	Reasoning	consider_opposite
a7ad05e0-7704-4b33-a4cd-ca7c190342ac	d87b4f85-b97a-466a-8c46-7f2958839af8	Hedgehog	it would break the rule	Non-probing-deliberation	Reasoning	
5ef70729-fd45-4346-bccb-5a889bae4de4	d87b4f85-b97a-466a-8c46-7f2958839af8	Guinea pig	that is true	Non-probing-deliberation	Agree	
daaa8e89-df1d-4fb2-8565-cfef654662c7	d87b4f85-b97a-466a-8c46-7f2958839af8	Giraffe	You know what, I think we only need to turn U over like Hedgehog first said.	Non-probing-deliberation	Solution	complete_solution
2e2648cf-50bd-4d3c-9066-eb8015411930	d87b4f85-b97a-466a-8c46-7f2958839af8	Guinea pig	Yea I think that would be the only way then	Non-probing-deliberation	Agree	
7cc74fdb-03c6-46cf-9f20-84189dd0957a	d87b4f85-b97a-466a-8c46-7f2958839af8	Hedgehog	Since we agree, do we just proceed?	Probing	Moderation	
1e937576-e140-4036-a659-1a6274794ae2	d87b4f85-b97a-466a-8c46-7f2958839af8	Guinea pig	Yea sounds like it lets just pick U and submit game	Non-probing-deliberation	Solution	complete_solution
388398ca-d870-42aa-acef-0c5a27d0db64	d87b4f85-b97a-466a-8c46-7f2958839af8	Hedgehog	Ok, leaving the room and submitting	Non-probing-deliberation	Agree	
55190da3-8454-4260-b411-ae589c3a9eb8	d87b4f85-b97a-466a-8c46-7f2958839af8	Giraffe	The rule is all cards with vowels on one side have an even number on the other. It doesn't matter if a card showing a number has vowel on the other side because we should be checking the cards with letters.	Non-probing-deliberation	Reasoning	
7275fab2-14fa-4a50-a072-57c92ffe8288	d87b4f85-b97a-466a-8c46-7f2958839af8	Giraffe	Maybe we pick U and L to also see if L have an even number.	Non-probing-deliberation	Reasoning	complete_solution
65efccb5-56e3-4eda-80d0-a15c3a9d9bd7	d87b4f85-b97a-466a-8c46-7f2958839af8	Hedgehog	hmm			
557408c7-a70a-4d67-b5f8-cf68b99587f1	d87b4f85-b97a-466a-8c46-7f2958839af8	Giraffe	Scratch that. Again, it only says cards with vowels. That's the focus.	Non-probing-deliberation	Reasoning	
be8dfd1f-8716-4926-9c3c-6908b013f58d	d87b4f85-b97a-466a-8c46-7f2958839af8	Hedgehog	the rule only cares able cards with vowels, it doesn't say cards with consenants can't have	Non-probing-deliberation	Reasoning	
9c169e12-bf57-4e9e-bd27-5ca3e1af2c4f	d87b4f85-b97a-466a-8c46-7f2958839af8	Hedgehog	*about			
cd259b18-aa0c-46d3-af8f-c2d33801bccd	d87b4f85-b97a-466a-8c46-7f2958839af8	Hedgehog	like you said.	Non-probing-deliberation	Agree	
4ae3329f-7d12-420c-ad86-2ba94ca25954	d87b4f85-b97a-466a-8c46-7f2958839af8	Hedgehog	I really think it is just U	Non-probing-deliberation	Solution	complete_solution
02eb0e6e-b332-408e-a3c6-2030e14d6e1d	d87b4f85-b97a-466a-8c46-7f2958839af8	Guinea pig	yea only vowels so I think we should just stick with U	Non-probing-deliberation	Reasoning	complete_solution
07e51790-f922-4ae4-b850-d502fb256af3	d87b4f85-b97a-466a-8c46-7f2958839af8	Giraffe	So just U? Everyone agrees?	Probing	Solution	solution_summary
93a7b8ba-8942-405d-acad-a79a32e6b871	d87b4f85-b97a-466a-8c46-7f2958839af8	Hedgehog	I think we are in agreement	Non-probing-deliberation	Agree	
60820fff-9346-4421-85f2-39952059a631	d87b4f85-b97a-466a-8c46-7f2958839af8	Guinea pig	yep just U	Non-probing-deliberation	Agree	complete_solution
de65e809-8a62-426c-8fd8-3f7ea9e68f5a	d87b4f85-b97a-466a-8c46-7f2958839af8	Giraffe	Okay. I'm submitting.	Non-probing-deliberation	Agree	
						
						
						
7902f46d-67bb-4856-ae4d-a16a7ebe474d	f052602b-0dbe-45f8-8407-f0887616ad41	Chipmunk	Hello everyone			
408bea27-dd77-467c-ba3f-512a29ace7c3	f052602b-0dbe-45f8-8407-f0887616ad41	Llama	Hello			
b8129b74-af57-4038-824d-b1fc203fd999	f052602b-0dbe-45f8-8407-f0887616ad41	Llama	Have you done this hit before?			
98d90041-6f86-4a7e-a16f-c292b0060eee	f052602b-0dbe-45f8-8407-f0887616ad41	Chipmunk	Nope - this is my first time.			
f4fe1009-7724-4647-8c23-9b283f40c2c4	f052602b-0dbe-45f8-8407-f0887616ad41	Llama	Ok, we only have 5 minutes it looks like.			
277af079-8211-4615-8fda-5b7bfe8651a0	f052602b-0dbe-45f8-8407-f0887616ad41	Alpaca	Hi, all!			
fbdcca17-d833-4cb0-bcbb-3980fbce5ee3	f052602b-0dbe-45f8-8407-f0887616ad41	Llama	Hi			
8b148c86-bbae-4ed4-9f5c-0c44a79ac6b1	f052602b-0dbe-45f8-8407-f0887616ad41	Llama	We have five minutes to argue I guess			
41d92069-2757-483c-ac04-e44f93d8bd48	f052602b-0dbe-45f8-8407-f0887616ad41	Chipmunk	Yes - so I know we definitely would need to flip the U" card - right?"	Non-probing-deliberation	Solution	partial_solution
e644dda0-90a9-4bff-8842-4bff174de7ec	f052602b-0dbe-45f8-8407-f0887616ad41	Llama	Yes, we should do that for various reasons	Non-probing-deliberation	Agree	
9ed140f5-2b07-4caf-9888-c1cad02b9992	f052602b-0dbe-45f8-8407-f0887616ad41	Alpaca	Yes, U and 5	Non-probing-deliberation	Agree	complete_solution
605db23b-aca7-494f-a90a-3ff8d7b667d6	f052602b-0dbe-45f8-8407-f0887616ad41	Chipmunk	Great. I also have U and 5.	Non-probing-deliberation	Agree	complete_solution
69d6528b-9c3d-4259-8fc0-579fc61d8f0e	f052602b-0dbe-45f8-8407-f0887616ad41	Llama	I did U and 5 too	Non-probing-deliberation	Agree	complete_solution
d4561064-c2b6-43ab-bd5d-49c78560242e	f052602b-0dbe-45f8-8407-f0887616ad41	Llama	Funny we all chose the same cards			
8efc13f3-18ff-4c3b-83cc-e2426dcf9aa9	f052602b-0dbe-45f8-8407-f0887616ad41	Alpaca	OK, now that we're all in agreement, we have more minutes to discuss, LOL			
e18a9c7d-2272-4dd6-8316-50761e6813a0	f052602b-0dbe-45f8-8407-f0887616ad41	Chipmunk	Yeah, I think that's probably the solution then.	Non-probing-deliberation	Agree	
4ce58839-4369-4103-a1df-98f0babb4b7f	f052602b-0dbe-45f8-8407-f0887616ad41	Llama	Ok sounds good, no argument necessary.	Non-probing-deliberation	Agree	
979d047a-d8a5-445d-8bf7-ff8acbdeefd2	f052602b-0dbe-45f8-8407-f0887616ad41	Alpaca	Hmm...anyone know how we can tell when the mandatory 5 minutes are up?			
25be0e89-5ef0-4e75-aff9-dbc0d4ad961d	f052602b-0dbe-45f8-8407-f0887616ad41	Chipmunk	I guess we can explain why the other cards aren't needed? Even though I imagine we already individually know the answer to that...	Probing	Reasoning	
a79986f5-43b9-412c-83a9-a5d02ebbe5bf	f052602b-0dbe-45f8-8407-f0887616ad41	Llama	I don't know how long this has to be, but a solution has been reached I think.			
df35e9b2-a03a-4fe5-8b62-d48a621d3322	f052602b-0dbe-45f8-8407-f0887616ad41	Alpaca	Rule 3 says: You are expected to participate actively in the conversation for at least 5 minutes.""			
1b347a6e-ec33-48c3-aba9-3e232fa71475	f052602b-0dbe-45f8-8407-f0887616ad41	Chipmunk	Instructions say at least 5 minutes. There is a timer in red text at the top of the page, but I think it's for the entire HIT, not just this portion of it.			
90dab0c5-419d-4963-912f-ab9e0f6fd14f	f052602b-0dbe-45f8-8407-f0887616ad41	Llama	Oh ok, there is little to discuss though.  The rules are not complete.	Non-probing-deliberation	Reasoning	
40829ffd-d4be-4bcc-ae7d-b4bb9832c4a0	f052602b-0dbe-45f8-8407-f0887616ad41	Alpaca	OK, I'll verbalize my choices.			
654f860b-be7e-4897-9088-b328894f21ff	f052602b-0dbe-45f8-8407-f0887616ad41	Alpaca	The card with 4 on it is not relevant to the rule, so it doesn't matter what's on the other side.	Non-probing-deliberation	Reasoning	
08e30c3c-fb0b-4499-b0ba-7b288966893c	f052602b-0dbe-45f8-8407-f0887616ad41	Llama	I agree, the I am overthinking the rules I guess.	Non-probing-deliberation	Agree	
c26ef7e6-ee2b-449e-b65d-2cc5a3a76551	f052602b-0dbe-45f8-8407-f0887616ad41	Chipmunk	The card with K is not relevant to the rule, since K is a consonant, not a vowel.	Non-probing-deliberation	Reasoning	
8955a691-d2e2-42a0-ba56-de82592ac669	f052602b-0dbe-45f8-8407-f0887616ad41	Alpaca	I was just typing what Chipmunk said. Yup, exactly.	Non-probing-deliberation	Agree	
52588f8e-f998-4ab8-989b-7444c59db69d	f052602b-0dbe-45f8-8407-f0887616ad41	Chipmunk	:)			
e65a0969-b805-4060-967c-0815b7373954	f052602b-0dbe-45f8-8407-f0887616ad41	Llama	Sounds simple enough			
7da3373c-4d50-4033-b175-540864091e8c	f052602b-0dbe-45f8-8407-f0887616ad41	Llama	I guess we just submit than?	Probing	Moderation	
3401c0ff-d663-4d6b-b487-da01c7b0da7b	f052602b-0dbe-45f8-8407-f0887616ad41	Alpaca	I just reread the rules, because why not? LOL			
d0b09ca0-ea7e-4028-951e-cff473d1a114	f052602b-0dbe-45f8-8407-f0887616ad41	Alpaca	Looks like we can all go ahead and Submit Game" again, at least."			
bb5cbefa-9419-4baf-9d83-45db6fa94a0b	f052602b-0dbe-45f8-8407-f0887616ad41	Alpaca	I'm now seeing a message to Complete HIT". I guess that means it's been long enough. Thanks, all!"			
						
						
						
						
b9b65322-b6a7-4667-8e64-f76c0137ac93	260bd13b-306d-4ec3-b32d-55b9e9646905	Duck	hello			
ac0c682e-65f8-4e4e-b5bf-85feb6b0ae34	260bd13b-306d-4ec3-b32d-55b9e9646905	Duck	I selected U and 6 but I am pretty sure that is not the correct answer	Non-probing-deliberation	Solution	complete_solution
4d6aba3d-bb3f-4e69-aaa8-9b03371695b4	260bd13b-306d-4ec3-b32d-55b9e9646905	Narwhal	hi there			
e4885b30-9ff1-40ef-9e5d-949f19cfda4d	260bd13b-306d-4ec3-b32d-55b9e9646905	Narwhal	Hi, Duck. I submitted U and 6.	Non-probing-deliberation	Solution	complete_solution
daad63b4-702b-4188-8e72-c11f781877ba	260bd13b-306d-4ec3-b32d-55b9e9646905	Narwhal	U and 5, I meant.	Non-probing-deliberation	Solution	complete_solution
2c02d7a4-6f77-4727-9b94-f7b863a937c6	260bd13b-306d-4ec3-b32d-55b9e9646905	Duck	what is the reasoning for 5?	Probing	Reasoning	
ee119608-a919-4b95-8dc2-c03810b32c46	260bd13b-306d-4ec3-b32d-55b9e9646905	Narwhal	are we waiting for one more person or this is it?			
897260e6-c61d-4c83-949f-df2c87b64fc2	260bd13b-306d-4ec3-b32d-55b9e9646905	Duck	i think our 3rd left			
fdd1d8c1-d651-4fae-aaab-0071f275183e	260bd13b-306d-4ec3-b32d-55b9e9646905	Narwhal	oh. anyways here is my reasoning, give me a sec to type it up.			
818c6b24-78a7-447f-a306-b06f82eea59d	260bd13b-306d-4ec3-b32d-55b9e9646905	Narwhal	if 5 has a vowel on the other side, it would go against the rule that all vowels have an even number on the other side.	Non-probing-deliberation	Reasoning	
da523f73-d57a-4944-8ce5-7823dce3d4d6	260bd13b-306d-4ec3-b32d-55b9e9646905	Narwhal	we don't care about turning 6, because any card can have an even number, not just vowels.	Non-probing-deliberation	Reasoning	
d55ee192-29f3-4154-9bbd-6ee93e2c06a8	260bd13b-306d-4ec3-b32d-55b9e9646905	Narwhal	It doesn't say only vowels""	Non-probing-deliberation	Reasoning	
095b2fc0-97c5-472a-bce2-9c5befeaa1b0	260bd13b-306d-4ec3-b32d-55b9e9646905	Duck	ahh i see thank you for explaining it to me	Non-probing-deliberation	Agree	
c5b7402b-f75f-4e7e-9e2a-8675f3d1d4bf	260bd13b-306d-4ec3-b32d-55b9e9646905	Duck	that makes sense	Non-probing-deliberation	Agree	
19cee3a9-8b7a-4050-85a4-ef08892f5265	260bd13b-306d-4ec3-b32d-55b9e9646905	Narwhal	same reason, we don't have to turn D.  D can have anything it wants: odds or zeros.	Non-probing-deliberation	Reasoning	
38ab0052-a70c-432d-a4e7-8d7d6a8092cb	260bd13b-306d-4ec3-b32d-55b9e9646905	Narwhal	or evens. D has the best life.	Non-probing-deliberation	Reasoning	
2da304d9-6b9f-4234-807f-72ef17f1fa77	260bd13b-306d-4ec3-b32d-55b9e9646905	Narwhal	So we are submitting U-5 and be done with this, right?	Probing	Solution	solution_summary
f5edb4bb-c31a-4203-82b5-acf5991eb295	260bd13b-306d-4ec3-b32d-55b9e9646905	Duck	Yep	Non-probing-deliberation	Agree	
4db7df3f-d7fa-499d-ab86-de473c13c26c	260bd13b-306d-4ec3-b32d-55b9e9646905	Duck	have a good day			
22b85d5d-31d1-4f9f-8e6c-4fba2999e178	260bd13b-306d-4ec3-b32d-55b9e9646905	Narwhal	You to, @Duck.			
						
						
						
712c3fb3-5d38-4738-91d4-870c4129b1ed	edcb5fa9-5f0a-4204-8b8f-990d9a06b53e	Giraffe	Well, I believe everyone got this right at once			
93179532-0018-4853-bdd2-9a1800c68442	edcb5fa9-5f0a-4204-8b8f-990d9a06b53e	Leopard	hello			
6d5057f6-cdef-4f94-8d46-ce08c868ac0a	edcb5fa9-5f0a-4204-8b8f-990d9a06b53e	Alpaca	How do you think its solved	Probing	Moderation	
793bb2a8-9522-4589-8a4a-6e9bfe536b34	edcb5fa9-5f0a-4204-8b8f-990d9a06b53e	Giraffe	@Alpaca Please drop your submission	Probing	Moderation	specific_addressee
2091fc81-939c-4e2e-a3b0-841ee2a3fd83	edcb5fa9-5f0a-4204-8b8f-990d9a06b53e	Leopard	well, the vowel cards have a number on the other side, and you can see the 4 an 7	Non-probing-deliberation	Reasoning	
6b80db3b-2b16-4792-94cd-b6932007e5d0	edcb5fa9-5f0a-4204-8b8f-990d9a06b53e	Giraffe	@Leopard Kindly drop your submission too	Probing	Moderation	specific_addressee
e0cf1121-30f8-4cb4-8d6c-0c5d946d9d6f	edcb5fa9-5f0a-4204-8b8f-990d9a06b53e	Giraffe	I feel since we are testing for vowels and even number, we need not bother about the others.	Non-probing-deliberation	Reasoning	
8fe38173-59c1-41d4-9984-962a5c170329	edcb5fa9-5f0a-4204-8b8f-990d9a06b53e	Alpaca	I think we would need to flip the 4 to see if its a vowel and the U to see if its even	Non-probing-deliberation	Reasoning	complete_solution
24ed3ab2-51a9-4765-886b-97ef7e1d077c	edcb5fa9-5f0a-4204-8b8f-990d9a06b53e	Giraffe	I agree with you @Alpaca	Non-probing-deliberation	Agree	specific_addressee
80c07719-02fb-4fef-8f7b-cfbb91123a20	edcb5fa9-5f0a-4204-8b8f-990d9a06b53e	Alpaca	@Leopard do you agree?	Probing	Moderation	specific_addressee
a4b11a74-df60-4af0-92a3-8eac0e97be5d	edcb5fa9-5f0a-4204-8b8f-990d9a06b53e	Leopard	wouldn't you need to flip all of them?	Probing	Solution	
510f184d-8ef7-4161-bab5-068283ecca91	edcb5fa9-5f0a-4204-8b8f-990d9a06b53e	Alpaca	Its only the cards required to prove the theory.	Non-probing-deliberation	Reasoning	
6ba0fee2-9a7a-4e74-b114-a21d847209e4	edcb5fa9-5f0a-4204-8b8f-990d9a06b53e	Giraffe	Well, it didn't ask to test consonants or odd numbers	Non-probing-deliberation	Reasoning	
5eeeebaa-7b19-4eed-8d8a-74ad9c187c3c	edcb5fa9-5f0a-4204-8b8f-990d9a06b53e	Alpaca	And it didn't say that consonants dont have even numbers so I feel the others are irrelevant	Non-probing-deliberation	Reasoning	
6de46798-b08d-4b5d-82b2-a9936068ac94	edcb5fa9-5f0a-4204-8b8f-990d9a06b53e	Giraffe	What will we hope to find out if we turn the C" card?"	Probing	Reasoning	
441c3788-328b-4e16-bd51-7d6ac0815c06	edcb5fa9-5f0a-4204-8b8f-990d9a06b53e	Alpaca	less than 2 minutes left			
71ec94a7-c7d8-4525-9d32-af3c10323f42	edcb5fa9-5f0a-4204-8b8f-990d9a06b53e	Leopard	we would hope to find an odd number	Non-probing-deliberation	Reasoning	
f5cb2674-8224-4a5c-8f73-636db43c3938	edcb5fa9-5f0a-4204-8b8f-990d9a06b53e	Leopard	I think you're right, only need to test cards with vowels	Non-probing-deliberation	Reasoning	
d0b93f6d-72b3-4e48-a327-850a8569b570	edcb5fa9-5f0a-4204-8b8f-990d9a06b53e	Alpaca	I would agree if it said vowels have even and consonants have odds. But it didnt say consonants cant have odds. Only the vowels have evens	Non-probing-deliberation	Reasoning	
3d533a6e-9aba-4d4f-a1f4-818f32ac9345	edcb5fa9-5f0a-4204-8b8f-990d9a06b53e	Leopard	consonants can have anything	Non-probing-deliberation	Reasoning	
a2a0fde9-70d6-4f85-89f2-f1e50bcda835	edcb5fa9-5f0a-4204-8b8f-990d9a06b53e	Leopard	so 'U' is the only one we need to turn, right?	Probing	Solution	complete_solution
06bb26b1-b8d8-433d-9e18-01de7d3d2e57	edcb5fa9-5f0a-4204-8b8f-990d9a06b53e	Giraffe	No. You will turn U and 4	Non-probing-deliberation	Solution	complete_solution
						
						
						
43f45512-8160-4c50-9c52-a1dc2bcbccb8	0610068a-0d3d-4fc2-a81b-94a74454700a	Ox	hey			
d22a14b8-9965-4e7a-972f-b78a718da37b	0610068a-0d3d-4fc2-a81b-94a74454700a	Alpaca	Hey			
0df4011b-81a6-4135-b316-c6d51e43dba1	0610068a-0d3d-4fc2-a81b-94a74454700a	Lion	Hello			
886338ce-ede7-48f2-b4c7-4c2b352dcc91	0610068a-0d3d-4fc2-a81b-94a74454700a	Alpaca	Do you think my cards are correct.	Probing	Solution	
cbcea4dd-e58a-4f1f-a6bd-962eef4b3df4	0610068a-0d3d-4fc2-a81b-94a74454700a	Alpaca	?			
360681f2-7ea3-4e39-bc29-387037100811	0610068a-0d3d-4fc2-a81b-94a74454700a	Ox	probably			
e511da72-406d-41be-9848-00cab3ea8a15	0610068a-0d3d-4fc2-a81b-94a74454700a	Alpaca	I chose A and M?	Non-probing-deliberation	Solution	complete_solution
31ffb479-6160-414c-9b5d-49049c3a64e0	0610068a-0d3d-4fc2-a81b-94a74454700a	Ox	we had to solve it ourselves			
ed106d2a-8015-4e0c-bae9-1ee3f38a16be	0610068a-0d3d-4fc2-a81b-94a74454700a	Lion	I think is correct	Non-probing-deliberation	Agree	
54f3b427-cafe-4b41-b4d8-678c806c16d4	0610068a-0d3d-4fc2-a81b-94a74454700a	Ox	sure'			
6cda6e9f-6988-43f7-871b-1135c854748d	0610068a-0d3d-4fc2-a81b-94a74454700a	Alpaca	Ox which cards did you chose?	Probing	Moderation	specific_addressee
9e3bc30f-92d7-4d54-975f-39d14a71f5e0	0610068a-0d3d-4fc2-a81b-94a74454700a	Lion	I choose A and M too	Non-probing-deliberation	Solution	complete_solution
1dc1b6ba-4fa4-4d63-88ed-53a0fe3a731e	0610068a-0d3d-4fc2-a81b-94a74454700a	Ox	I chose a and 4 but a and m sounds more correct	Non-probing-deliberation	Solution	complete_solution
fdf8ca72-d2bd-469b-aac0-c623131cb24e	0610068a-0d3d-4fc2-a81b-94a74454700a	Ox	2 v 1	Non-probing-deliberation	Reasoning	
c5ce6e45-5b58-406c-9f3a-e5dbafdcc7b1	0610068a-0d3d-4fc2-a81b-94a74454700a	Ox	might as well go with the flow	Non-probing-deliberation	Reasoning	
ad9bcd88-934c-464d-bde4-00d3fc54a988	0610068a-0d3d-4fc2-a81b-94a74454700a	Alpaca	Wait it was either an even number or a vowel? Right?	Non-probing-deliberation	Reasoning	
1e454510-7aa6-4cb0-8682-bad79837934a	0610068a-0d3d-4fc2-a81b-94a74454700a	Lion	Yes, it is either the two	Non-probing-deliberation	Reasoning	
7bc180a8-8537-4da1-ab2b-a3bddf9cfa0c	0610068a-0d3d-4fc2-a81b-94a74454700a	Ox	All cards with vowels on one side have an even number on the other.	Non-probing-deliberation	Solution	
ebe0ecf3-c42c-48fb-8c6a-bb1360b65c7d	0610068a-0d3d-4fc2-a81b-94a74454700a	Alpaca	I think that is more correct. We should choose between A and 4, that sounds more correct.	Non-probing-deliberation	Reasoning	
f84e2f96-4e03-40d6-b5b7-202d34741b3b	0610068a-0d3d-4fc2-a81b-94a74454700a	Ox	thats why I said A 4	Non-probing-deliberation	Solution	complete_solution
5351c91b-4544-4187-a542-4b562298b451	0610068a-0d3d-4fc2-a81b-94a74454700a	Alpaca	That is great. Thank you.	Non-probing-deliberation	Agree	
4fd072e1-42e3-4539-99e3-7147e96facd8	0610068a-0d3d-4fc2-a81b-94a74454700a	Ox	cool			
a200f2fa-b45b-4e61-9cd9-e76b3722f3ac	0610068a-0d3d-4fc2-a81b-94a74454700a	Alpaca	I think we should submit the game	Probing	Moderation	
03ab3dd5-9642-49ff-9b1d-2efc498b1bcc	0610068a-0d3d-4fc2-a81b-94a74454700a	Lion	great	Non-probing-deliberation	Agree	
5d84386b-773c-41bf-b025-9622cc715173	0610068a-0d3d-4fc2-a81b-94a74454700a	Ox	ayyyy			
275abcf2-e5fe-4791-a15a-93b14c2aec69	0610068a-0d3d-4fc2-a81b-94a74454700a	Alpaca	Is that ok with everyone?	Probing	Moderation	
e5d46171-1650-4ccc-8f10-98bb1d2435dc	0610068a-0d3d-4fc2-a81b-94a74454700a	Ox	ok	Non-probing-deliberation	Agree	
edfa360c-261b-4539-bb87-c1118b42957d	0610068a-0d3d-4fc2-a81b-94a74454700a	Lion	yes	Non-probing-deliberation	Agree	
7372464a-74de-4771-a206-63c2dc142ee2	0610068a-0d3d-4fc2-a81b-94a74454700a	Alpaca	Okay bye. Thank you for your time. I hope we spent more than 5 minutes on this.			
						
						
						
6ce83fbe-13d4-4a0b-82a7-0798d8298706	9d8da52d-75a4-4486-82a5-efa395017b96	Duck	HI FRIEND			
3afd4a91-f571-4c3a-b4ad-c9520e52058c	9d8da52d-75a4-4486-82a5-efa395017b96	Lobster	So I picked three, so you could see if there’s a vowel on the other side.	Non-probing-deliberation	Reasoning	
67697fff-c422-4f7b-91a4-ed9767905b3b	9d8da52d-75a4-4486-82a5-efa395017b96	Lobster	Hello! :)			
2fc47f8d-acf4-4e66-9a5a-0e2cd8738f65	9d8da52d-75a4-4486-82a5-efa395017b96	Duck	NO I SEE CONSONANTS	Non-probing-deliberation	Solution	
4981776e-fc46-48d5-9a53-a843a72740dd	9d8da52d-75a4-4486-82a5-efa395017b96	Duck	HELLO			
057077b3-c6f2-4ede-acfb-67d4d69ff4da	9d8da52d-75a4-4486-82a5-efa395017b96	Lobster	So you think the z Card?	Probing	Solution	
1e563c53-412e-4458-9ca9-44b70a0b5046	9d8da52d-75a4-4486-82a5-efa395017b96	Duck	YES	Non-probing-deliberation	Agree	
ce1f40d0-4057-434c-acb0-c1b63785cda6	9d8da52d-75a4-4486-82a5-efa395017b96	Lobster	What’s the reasoning?	Probing	Reasoning	
f54f540c-951e-4bb8-adab-0113a7e3be04	9d8da52d-75a4-4486-82a5-efa395017b96	Duck	BACK SIDE OF Z  CONTAIN VOWELS	Non-probing-deliberation	Reasoning	
c0ef8200-9086-466a-ab9d-c949b31135a0	9d8da52d-75a4-4486-82a5-efa395017b96	Lobster	shouldn’t it have a number?	Probing	Reasoning	
1149d375-e141-488a-b5ae-5b6eda0dd474	9d8da52d-75a4-4486-82a5-efa395017b96	Duck	WHAT NUMBER	Non-probing-deliberation	Solution	
06f51fff-2ebe-4ac3-8eaf-18526a6acc23	9d8da52d-75a4-4486-82a5-efa395017b96	Lobster	I’m not sure, an even or an odd.	Non-probing-deliberation	Reasoning	
d6d6ad24-9c60-4a6c-994c-afe9a0bf72ae	9d8da52d-75a4-4486-82a5-efa395017b96	Duck	OH GOOD	Non-probing-deliberation	Agree	
a205382c-7c34-4ba9-9f13-ab501bbb7e3e	9d8da52d-75a4-4486-82a5-efa395017b96	Duck	THATS GREAT	Non-probing-deliberation	Agree	
7d32bccf-4dc6-46c5-867e-fbdc8f1fa6d5	9d8da52d-75a4-4486-82a5-efa395017b96	Lobster	I’m not really sure which we should flip			
518d5b05-3d49-4db2-8023-7e784351aabd	9d8da52d-75a4-4486-82a5-efa395017b96	Duck	I THINK THAT THE ANSWER,YOUR ANSWER IS CORRECT.	Non-probing-deliberation	Agree	
29da9362-17ea-4031-8f35-c58925f48f10	9d8da52d-75a4-4486-82a5-efa395017b96	Lobster	So if 3 has a vowel, we know the rule is false?	Non-probing-deliberation	Reasoning	
1fbad7da-0374-4c87-a75c-a7b483d4f3f4	9d8da52d-75a4-4486-82a5-efa395017b96	Duck	NO TRUE	Non-probing-deliberation	Agree	
c6284d77-9019-4536-a334-9e94545267fc	9d8da52d-75a4-4486-82a5-efa395017b96	Lobster	Vowels need to have an even number to verify the rule	Non-probing-deliberation	Reasoning	
2887090b-27e1-4d5c-9df4-3bd2eef27ff5	9d8da52d-75a4-4486-82a5-efa395017b96	Duck	YES	Non-probing-deliberation	Agree	
b83579b4-1ce6-4504-beaa-d98d954824d7	9d8da52d-75a4-4486-82a5-efa395017b96	Duck	THAT NUMBER IS NOT 3 ITS 2			
862a3fc5-9a26-4175-9352-f2583d6d42d5	9d8da52d-75a4-4486-82a5-efa395017b96	Lobster	okay, so we want to try 2?	Probing	Solution	
1fe10484-6669-40e8-a7c1-52e93bb13dab	9d8da52d-75a4-4486-82a5-efa395017b96	Duck	YES	Non-probing-deliberation	Agree	
03121cb8-b503-492c-b827-9ae67a0a0f7b	9d8da52d-75a4-4486-82a5-efa395017b96	Lobster	I suppose it’s as good as any! We can submit 2	Non-probing-deliberation	Agree	complete_solution
72ac07d8-c990-49ad-a590-2be0fe07f5a2	9d8da52d-75a4-4486-82a5-efa395017b96	Duck	THANK YOU			
						
						
						
a56984ae-3b7c-4bce-b6d4-848dfefbc8b9	7db016ee-7a8e-47b0-818a-78e657ec2377	Falcon	Hello			
128a8a70-5ac6-4ac5-be29-d715ca796dca	7db016ee-7a8e-47b0-818a-78e657ec2377	Guinea pig	what does everyone think is the correct solution?	Probing	Moderation	
c65c1444-59d7-4736-ad7a-130b00676faa	7db016ee-7a8e-47b0-818a-78e657ec2377	Guinea pig	Hello			
d1036a0f-c01a-4667-9256-fa5ab21cfd22	7db016ee-7a8e-47b0-818a-78e657ec2377	Falcon	I was originally thinking the U and the S	Non-probing-deliberation	Solution	complete_solution
f13ae0ca-b1ed-4201-80ab-b51a2cb16d3a	7db016ee-7a8e-47b0-818a-78e657ec2377	Falcon	What do you think	Probing	Moderation	specific_addressee
fcf75458-5b10-423a-aa07-db25747b1ed4	7db016ee-7a8e-47b0-818a-78e657ec2377	Guinea pig	this is tricky, I see why you chose that. I thought of checking 8 and U but I know that's not correct because we need to check either 9 or S	Non-probing-deliberation	Reasoning	
bb7fada8-0aa1-4f6f-a06d-08149253e7f3	7db016ee-7a8e-47b0-818a-78e657ec2377	Guinea pig	to be honest I'm stumped lol			
1c8c90d6-6dd5-404a-bfa6-56539b6568ca	7db016ee-7a8e-47b0-818a-78e657ec2377	Falcon	Same lol			
350a5a18-adaa-487b-96b5-a8df1d2bce2a	7db016ee-7a8e-47b0-818a-78e657ec2377	Falcon	I keep changing my mind			
d5183c89-8eb5-4014-9496-e3c1c1a36b88	7db016ee-7a8e-47b0-818a-78e657ec2377	Guinea pig	me too			
8d72a050-4cce-4629-b1d7-6fba575ea10c	7db016ee-7a8e-47b0-818a-78e657ec2377	Falcon	I guess I don't understand why we wouldn't turn over every card	Non-probing-deliberation	Reasoning	
84b061d8-bcc5-4d89-b995-2bc75005d767	7db016ee-7a8e-47b0-818a-78e657ec2377	Guinea pig	really you should check all 4 cards	Non-probing-deliberation	Solution	complete_solution
8e8c0a32-5ece-4125-a8a0-58e926e411cd	7db016ee-7a8e-47b0-818a-78e657ec2377	Guinea pig	oh lol same thought	Non-probing-deliberation	Agree	
5803232d-a74b-47d3-93c7-ada4ffd8fcc9	7db016ee-7a8e-47b0-818a-78e657ec2377	Guinea pig	it's the only way if you think logically right?	Non-probing-deliberation	Reasoning	
7b4b099e-f1c0-4d82-ab50-be5a56fbc3d1	7db016ee-7a8e-47b0-818a-78e657ec2377	Falcon	or just the 8 and U if I reread the instructions?	Non-probing-deliberation	Reasoning	complete_solution
3041459b-91b4-483c-ba43-942894245f22	7db016ee-7a8e-47b0-818a-78e657ec2377	Falcon	never mind			
d6a888e0-0823-49b4-892e-e0a098284f4e	7db016ee-7a8e-47b0-818a-78e657ec2377	Falcon	I'm overthinking it			
41cc0d26-85c3-4882-ac76-30678e5eaef8	7db016ee-7a8e-47b0-818a-78e657ec2377	Guinea pig	yeah I think I am too			
4a951608-cef6-4f32-91b4-91190699b6d1	7db016ee-7a8e-47b0-818a-78e657ec2377	Falcon	I think we're out of time			
df5983af-3702-46cb-a56b-136926f85d24	7db016ee-7a8e-47b0-818a-78e657ec2377	Guinea pig	Okay			
ba8506db-1313-4650-a6ee-c0e1de59e0af	7db016ee-7a8e-47b0-818a-78e657ec2377	Falcon	All?	Probing	Solution	solution_summary
32ec781d-4d57-4113-8168-0e4de4ff9cbf	7db016ee-7a8e-47b0-818a-78e657ec2377	Guinea pig	yeah	Non-probing-deliberation	Agree	
78fea460-b5c4-488e-abba-14b8e18db8b3	7db016ee-7a8e-47b0-818a-78e657ec2377	Falcon	thank you!			
92f74f40-3156-40ef-a942-91d4ede91484	7db016ee-7a8e-47b0-818a-78e657ec2377	Guinea pig	yw, thank you!			
						
						
						
3bd59ff6-18a5-40ae-994f-de84226ff2bb	eb0db1d0-a094-4c5d-8449-895c4655e228	Bat	hello! what did you pick? i chose G and 4	Non-probing-deliberation	Solution	complete_solution
b48f6ae2-e527-4b46-9fb3-339f3baa8ef3	eb0db1d0-a094-4c5d-8449-895c4655e228	Giraffe	I only chose E	Non-probing-deliberation	Solution	complete_solution
061f0a15-911d-49d8-ad28-f430ad9bb20a	eb0db1d0-a094-4c5d-8449-895c4655e228	Llama	I think the E and 4 need turned over.	Non-probing-deliberation	Solution	complete_solution
