Message_id	room_id	Origin	Content	Type	Target	Additional
7626d4d6-b07d-41e2-95ce-da3f48d745e6	d86f671e-f5de-4637-a450-2649ec5847e1	Giraffe	Can you see the Complete Hit button?			
a6eec4db-657e-40b7-9851-4a3cdf516a9a	d86f671e-f5de-4637-a450-2649ec5847e1	Leopard	hmm			
b1a762fc-3b24-444d-889b-3ffb372867da	d86f671e-f5de-4637-a450-2649ec5847e1	Alpaca	no			
f5e530ff-19fc-40a1-86d7-9692d13105ce	d86f671e-f5de-4637-a450-2649ec5847e1	Leopard	we should ask in messenger chat			
5fd3b4d0-d482-4e68-a324-01a3f320afbf	d86f671e-f5de-4637-a450-2649ec5847e1	Alpaca	i just did :P			
92bfb6f5-1df3-4f94-bedf-c7afcc556432	d86f671e-f5de-4637-a450-2649ec5847e1	Alpaca	i didnt realise yous were asking here XD			
						
						
						
5a0b245f-ce7a-49fe-8a7e-10f8a2f6612c	b381d5ca-df12-447b-8b2d-27bae81f6f7d	Kiwi	Hello			
89ad7215-f954-4f4e-a47c-e6e9aa15864a	b381d5ca-df12-447b-8b2d-27bae81f6f7d	Llama	Hello			
4445b5d2-d02d-409a-8263-a2dffe68c70c	b381d5ca-df12-447b-8b2d-27bae81f6f7d	Narwhal	Hello			
dcc66eaa-d85d-40f6-a8bb-c2f915ca9516	b381d5ca-df12-447b-8b2d-27bae81f6f7d	Llama	so I take it we have to come to a decision	Probing	Moderation	
cbbf7ba8-96af-477c-9035-b9365d01cfb3	b381d5ca-df12-447b-8b2d-27bae81f6f7d	Kiwi	I believe so	Non-probing-deliberation	Agree	
e67f0df0-8a26-4bfc-852a-419c8f9b1e63	b381d5ca-df12-447b-8b2d-27bae81f6f7d	Llama	I say E and 2	Non-probing-deliberation	Solution	complete_solution
457484b2-2dbc-4c96-9ec1-58575ae3889c	b381d5ca-df12-447b-8b2d-27bae81f6f7d	Kiwi	I agree	Non-probing-deliberation	Agree	
c7ec2447-5633-4cc6-a5b0-d7a08fb15b01	b381d5ca-df12-447b-8b2d-27bae81f6f7d	Narwhal	I agree with you both	Non-probing-deliberation	Agree	
189823ad-db7b-447c-9b57-50efeb5244b6	b381d5ca-df12-447b-8b2d-27bae81f6f7d	Llama	Okay, Lets submit	Probing	Moderation	
c1d4d18e-803a-43f6-b87c-67de426ccda6	b381d5ca-df12-447b-8b2d-27bae81f6f7d	Kiwi	Alright			
7037959e-5249-4f36-8515-547244111a57	b381d5ca-df12-447b-8b2d-27bae81f6f7d	Llama	ahh, we have a timer in the uper right that says we have 4 minutes to go			
d4faeea0-c72d-4c8e-a646-75d1532c22be	b381d5ca-df12-447b-8b2d-27bae81f6f7d	Narwhal	So I guess we can discuss why we decided on E and 2	Probing	Reasoning	
909c4608-f70c-4eff-951b-259b3901e52f	b381d5ca-df12-447b-8b2d-27bae81f6f7d	Narwhal	Well, E is a vowel and 2 is an even number	Non-probing-deliberation	Reasoning	
8ef18c81-3f5c-4173-b2d1-41173994fa37	b381d5ca-df12-447b-8b2d-27bae81f6f7d	Llama	i thought that if the cards had to have a vowel or even number on both sides e and 2 made sense	Non-probing-deliberation	Reasoning	complete_solution
37fe1ccf-6219-4c2a-b821-6d8027a0f93d	b381d5ca-df12-447b-8b2d-27bae81f6f7d	Narwhal	Yeah, those cards would test the rule	Non-probing-deliberation	Reasoning	
924b9b42-2ff4-4b4c-a645-490f917d2b98	b381d5ca-df12-447b-8b2d-27bae81f6f7d	Llama	it's the only thing that makes sense to me	Non-probing-deliberation	Reasoning	
92dc39b0-81a5-43df-8ded-999c523c22b0	b381d5ca-df12-447b-8b2d-27bae81f6f7d	Kiwi	It would only make sense to turn them both because if you just turned the E card then that could be an exception. So it makes sense to turn both E and 2 to check that it works both ways	Non-probing-deliberation	Reasoning	complete_solution
c52dd24e-aa76-4511-8813-8758e12f6486	b381d5ca-df12-447b-8b2d-27bae81f6f7d	Llama	I agree	Non-probing-deliberation	Agree	
e619fb9b-da81-4fe3-a41f-69423d348c3e	b381d5ca-df12-447b-8b2d-27bae81f6f7d	Narwhal	@Kiwi true	Non-probing-deliberation	Agree	specific_addressee
6b649740-a6f5-4935-9010-ab54281ddbd6	b381d5ca-df12-447b-8b2d-27bae81f6f7d	Llama	So I guess we're all in agreement	Probing	Moderation	
b27d92f5-81d6-472d-a5cb-8325aadb9273	b381d5ca-df12-447b-8b2d-27bae81f6f7d	Kiwi	I am glad we came to a conclusion quickly without any arguments			
2a3557a7-90f8-4a83-93b9-3118ca619ef5	b381d5ca-df12-447b-8b2d-27bae81f6f7d	Llama	Me too			
0c312916-1a6f-4783-be54-1c4f2cdcdebb	b381d5ca-df12-447b-8b2d-27bae81f6f7d	Kiwi	It was a pleasure to work with you both			
4c4c037f-36f5-40d7-9b92-2c5d313f8eda	b381d5ca-df12-447b-8b2d-27bae81f6f7d	Llama	Likewise :)			
1263c749-0453-4082-a94d-14fa4d7ca7ab	b381d5ca-df12-447b-8b2d-27bae81f6f7d	Narwhal	Thank you. Same here. Good luck!			
						
						
						
ff1211ff-550d-4887-b98d-6b924b7a81f2	5aac04da-fbc1-475e-a21e-4260d46e1c8b	Hedgehog	Hello there.			
c9b83c64-2fef-43b2-a4aa-55e3138c84b8	5aac04da-fbc1-475e-a21e-4260d46e1c8b	Leopard	hello			
8ca9567e-4c5d-46ee-958a-d057c4608fd2	5aac04da-fbc1-475e-a21e-4260d46e1c8b	Hedgehog	So I'm guessing we probably want to flip the letter, and the even number.  Possibly also an odd one?	Non-probing-deliberation	Reasoning	
9013444f-4ed8-4f55-a7d7-abf26a129685	5aac04da-fbc1-475e-a21e-4260d46e1c8b	Leopard	i sgree	Non-probing-deliberation	Agree	
ab6ddf3c-1a76-4e47-886a-89187bf86d3a	5aac04da-fbc1-475e-a21e-4260d46e1c8b	Leopard	probably even with a vowel?	Non-probing-deliberation	Solution	partial_solution
eda55821-d445-4409-9a78-86c0713bbb70	5aac04da-fbc1-475e-a21e-4260d46e1c8b	Hedgehog	How many cards do you think at minimum we need to flip to confirm the rule?	Probing	Reasoning	
2fa33dda-5823-4e6d-94f9-57cb2fe2f97a	5aac04da-fbc1-475e-a21e-4260d46e1c8b	Leopard	maybe 2	Non-probing-deliberation	Reasoning	
2a4e7079-2322-4afb-94c2-b194e337486e	5aac04da-fbc1-475e-a21e-4260d46e1c8b	Hedgehog	I only have a D, 1, 2, and 9.  So I don't have a vowel one.	Non-probing-deliberation	Solution	
b8fc5110-cb9a-4a96-aba9-ac936ee8aa36	5aac04da-fbc1-475e-a21e-4260d46e1c8b	Hedgehog	or maybe im stupid and the 1 is an I lol	Non-probing-deliberation	Solution	
e5620d0d-c25a-4632-b2d8-277cbfcd6bf6	5aac04da-fbc1-475e-a21e-4260d46e1c8b	Leopard	lol			
1b7daf84-fa81-4e11-9d47-6951f0915f6c	5aac04da-fbc1-475e-a21e-4260d46e1c8b	Leopard	I picked I and 2	Non-probing-deliberation	Solution	complete_solution
2b7a0263-bdae-40e7-9150-16b500bbdd32	5aac04da-fbc1-475e-a21e-4260d46e1c8b	Hedgehog	I picked D and 2	Non-probing-deliberation	Solution	complete_solution
e6d8ff36-b0c1-4abf-9eeb-9e7ca0244947	5aac04da-fbc1-475e-a21e-4260d46e1c8b	Leopard	but I am just guessing			
5c9aa280-1038-4cdc-b376-0d0b152a56b1	5aac04da-fbc1-475e-a21e-4260d46e1c8b	Leopard	we can try D and 2	Non-probing-deliberation	Solution	complete_solution
7a834b71-e4ad-44ae-b9e2-894cd70a8ae4	5aac04da-fbc1-475e-a21e-4260d46e1c8b	Hedgehog	So, we probably don't need the 9, I think we both agree there.  I don't think the 9 determines really anything	Non-probing-deliberation	Reasoning	
e7caa82b-0c4e-4199-a71c-7fbe73d0c6f1	5aac04da-fbc1-475e-a21e-4260d46e1c8b	Hedgehog	We need to talk for 5 minutes though, so lets try to reason this out a bit more I suppose	Probing	Moderation	
1fbaabaf-3e76-4e7d-b58f-434ab535672d	5aac04da-fbc1-475e-a21e-4260d46e1c8b	Leopard	sure	Non-probing-deliberation	Agree	
c794a5dd-6b20-4133-8d1e-fca74e74d3c8	5aac04da-fbc1-475e-a21e-4260d46e1c8b	Hedgehog	So, lets go one by one I think is the simplest way to reason this out	Probing	Moderation	
d09c4acb-8fbd-4873-bf01-66e9ba9d8eaa	5aac04da-fbc1-475e-a21e-4260d46e1c8b	Hedgehog	So, maybe we don't need to test D.  Since it's not a vowel.	Non-probing-deliberation	Reasoning	
58a475e9-574c-4d59-8d48-8cd4a33d469c	5aac04da-fbc1-475e-a21e-4260d46e1c8b	Leopard	I am trying to relate numbers to the ltters	Non-probing-deliberation	Reasoning	
898e23b5-d552-4d8f-8077-0778e43f70f9	5aac04da-fbc1-475e-a21e-4260d46e1c8b	Hedgehog	I think it's hard to know if that's an I or a 1, and that's making this hard.	Non-probing-deliberation	Reasoning	
896e93ed-d534-46a7-a3cc-1c5ff92242dd	5aac04da-fbc1-475e-a21e-4260d46e1c8b	Leopard	I is 9	Non-probing-deliberation	Reasoning	
6a7751d8-175f-4743-93e8-7c22c3b988f1	5aac04da-fbc1-475e-a21e-4260d46e1c8b	Leopard	because it is the 9th letter	Non-probing-deliberation	Reasoning	
72c69ff5-473e-4f91-91c0-52e6699cbf67	5aac04da-fbc1-475e-a21e-4260d46e1c8b	Hedgehog	if it's an I, I think we'd want to flip it, but if it's a 1 we don't need to.	Non-probing-deliberation	Reasoning	
cf239212-44b9-4265-ac71-28fa0eeeccaa	5aac04da-fbc1-475e-a21e-4260d46e1c8b	Hedgehog	But do we know the cards have the number of the alphabet they relate to on the other side, or is it a random?	Probing	Reasoning	
651f26d9-29cc-475d-90fd-c70e792a9719	5aac04da-fbc1-475e-a21e-4260d46e1c8b	Leopard	i have no idea that is the only thing I can piece togther and that makes sense in my mind	Non-probing-deliberation	Reasoning	
3e89888d-6691-4422-9137-c3dc1bb02740	5aac04da-fbc1-475e-a21e-4260d46e1c8b	Hedgehog	I think we hsould probably assume the thing between D, and 2, is an I.  I feel like they'd probably do something to differentiate.	Non-probing-deliberation	Reasoning	
54b0ff51-7dd3-4dc8-81d0-6895dcd70fa9	5aac04da-fbc1-475e-a21e-4260d46e1c8b	Leopard	so what is your thinking	Probing	Moderation	specific_addressee
f9061813-d6d2-4527-b0e2-4b8f0c93e744	5aac04da-fbc1-475e-a21e-4260d46e1c8b	Hedgehog	So I think we should flip that one to test the vowel rule.	Non-probing-deliberation	Reasoning	partial_solution
b33eb613-3411-4b25-9f23-987cf57177a8	5aac04da-fbc1-475e-a21e-4260d46e1c8b	Leopard	ok	Non-probing-deliberation	Agree	
7f44928f-5709-4f80-a63c-aca7e4910bb9	5aac04da-fbc1-475e-a21e-4260d46e1c8b	Hedgehog	and probably the two, as well, to see if it's an even number?	Non-probing-deliberation	Reasoning	partial_solution
6dd794cc-a786-48b1-9f3f-de84637890dd	5aac04da-fbc1-475e-a21e-4260d46e1c8b	Leopard	So D and 2?	Probing	Solution	solution_summary
f1277e2c-1f44-4266-a998-1daf4ec3df05	5aac04da-fbc1-475e-a21e-4260d46e1c8b	Hedgehog	I think those make the most sense, I could be way off base though.	Non-probing-deliberation	Agree	
8782db8d-f0ef-436e-9512-ceec7b65ba37	5aac04da-fbc1-475e-a21e-4260d46e1c8b	Leopard	ok i am going to hit submit with the D and the 2	Non-probing-deliberation	Solution	complete_solution
69c6e5d3-d9e9-4cd1-88dc-968779f86676	5aac04da-fbc1-475e-a21e-4260d46e1c8b	Hedgehog	What do you think?	Probing	Moderation	
e6ef5a88-d058-4844-b6ba-a45b64bb34b4	5aac04da-fbc1-475e-a21e-4260d46e1c8b	Hedgehog	alright.  I think it's been about 5, I'll agree there and do the same.	Non-probing-deliberation	Agree	
7f4a9e1b-befd-41ad-b6c3-754452ec6acb	5aac04da-fbc1-475e-a21e-4260d46e1c8b	Leopard	I think its I an 9	Non-probing-deliberation	Solution	complete_solution
47396766-a46e-404e-a46f-cd18a3231b2b	5aac04da-fbc1-475e-a21e-4260d46e1c8b	Hedgehog	We can do that too			
b10bdb7f-08c1-4fef-8bf8-f8a2fa28f206	5aac04da-fbc1-475e-a21e-4260d46e1c8b	Hedgehog	Do we want to do the I and 9 instead?	Probing	Solution	solution_summary
b9868941-bd43-4569-857c-1d63e84c2b80	5aac04da-fbc1-475e-a21e-4260d46e1c8b	Leopard	if you want to I will	Non-probing-deliberation	Agree	
94436fc9-c4c2-41e8-b8f3-d41b1b56eca1	5aac04da-fbc1-475e-a21e-4260d46e1c8b	Leopard	I dont mind			
db118706-159e-4067-9c18-38e9ed421968	5aac04da-fbc1-475e-a21e-4260d46e1c8b	Hedgehog	Alright, let's go with the I and 9 then.	Non-probing-deliberation	Solution	complete_solution
61026f40-f346-43a2-a3db-8a1759753002	5aac04da-fbc1-475e-a21e-4260d46e1c8b	Leopard	ok	Non-probing-deliberation	Agree	
dba3782c-a35c-4cd0-9813-5d14a499cb5b	5aac04da-fbc1-475e-a21e-4260d46e1c8b	Leopard	i am going to submit it now then			
51e4f079-d37c-42f9-b7e8-3f39558229c0	5aac04da-fbc1-475e-a21e-4260d46e1c8b	Hedgehog	Was a pleasure chatting with you, stay safe!			
07e0f629-7b2d-4a18-97d4-b58d21d18b50	5aac04da-fbc1-475e-a21e-4260d46e1c8b	Hedgehog	Ditto			
6c047f75-be09-48ab-b625-709ba9126ebc	5aac04da-fbc1-475e-a21e-4260d46e1c8b	Leopard	you too			
						
						
						
7bf7d309-2ab9-458d-8faa-6b9cef1b2e90	85c822b6-420c-42e8-bb2c-ba88d52aaae9	Cat	Hello			
def026c2-c5ff-47c6-9f39-188d5a6c9919	85c822b6-420c-42e8-bb2c-ba88d52aaae9	Lion	Howdy			
d5754801-9a32-4f2d-b29e-0270b128cd6c	85c822b6-420c-42e8-bb2c-ba88d52aaae9	Leopard	Hey guys, are you all agreeing that F is the only card that needs to be flipped?	Non-probing-deliberation	Solution	complete_solution
76bc6d33-a1e7-4ac8-96e2-14d905288fe6	85c822b6-420c-42e8-bb2c-ba88d52aaae9	Leopard	I doubt there's an even number on the other side of an odd-numbered card.	Non-probing-deliberation	Reasoning	
c422bfa1-23d7-46e5-b5ae-893008fbf8ff	85c822b6-420c-42e8-bb2c-ba88d52aaae9	Cat	I thought I would need I and 2 since they apply to the rule	Non-probing-deliberation	Reasoning	complete_solution
4bf3f0f4-34ff-43b5-aa30-30a7d6507f34	85c822b6-420c-42e8-bb2c-ba88d52aaae9	Lion	I think I would be required to double check it.	Non-probing-deliberation	Reasoning	partial_solution
24ac5e88-7066-4e5b-8eba-144b620d8b91	85c822b6-420c-42e8-bb2c-ba88d52aaae9	Lion	Sorry I" would be required."			
0f9b3c1c-b844-43f0-a926-497d086435a7	85c822b6-420c-42e8-bb2c-ba88d52aaae9	Leopard	Then it would be I and F since both could have an even number on the other side?	Non-probing-deliberation	Reasoning	complete_solution
b2e4eeaf-7aaa-4e2f-9139-558eb7fb8e32	85c822b6-420c-42e8-bb2c-ba88d52aaae9	Cat	Maybe just I since 2 could theoretically have any letter	Non-probing-deliberation	Reasoning	complete_solution
18e1487c-df16-435c-a3f5-c2fabda5f4e8	85c822b6-420c-42e8-bb2c-ba88d52aaae9	Lion	Agreed, Cat.	Non-probing-deliberation	Agree	specific_addressee
db2558c9-92f6-4ecd-8bb3-f676d0d4cb28	85c822b6-420c-42e8-bb2c-ba88d52aaae9	Lion	I think it's I and F.	Non-probing-deliberation	Solution	complete_solution
0d0cf804-36bb-4d2d-add4-f53f6ebc1c0a	85c822b6-420c-42e8-bb2c-ba88d52aaae9	Cat	I don't think F matters at all because it doesn't tell us anything about excluding any other rules	Non-probing-deliberation	Reasoning	
5657627f-4776-48c2-af29-4d09d8d66d3a	85c822b6-420c-42e8-bb2c-ba88d52aaae9	Cat	I originally said I and 2 but I know think it's just I	Non-probing-deliberation	Solution	complete_solution
8661c6a1-a97d-4efa-b6bb-24b320277edb	85c822b6-420c-42e8-bb2c-ba88d52aaae9	Lion	Ah, I see. Yeah, the rule doesn't mention consonants at all.	Non-probing-deliberation	Reasoning	
e9d1f4df-8d1f-40f5-ad53-b3ac142a97bd	85c822b6-420c-42e8-bb2c-ba88d52aaae9	Lion	It's just looking for vowels.	Non-probing-deliberation	Reasoning	
9707c598-eb9b-439b-928d-9fd75d570dbf	85c822b6-420c-42e8-bb2c-ba88d52aaae9	Leopard	If you turned over the 9 and there was a vowel on the other side then wouldn't that disprove the rule too?	Non-probing-deliberation	Reasoning	partial_solution
4d906469-5064-40c7-9dc4-d6b121418a59	85c822b6-420c-42e8-bb2c-ba88d52aaae9	Cat	Hmmm			
096b45e7-09a9-4c65-a3de-eb6001e8e0ea	85c822b6-420c-42e8-bb2c-ba88d52aaae9	Cat	Wow I think you are right	Non-probing-deliberation	Agree	specific_addressee
d843556e-5cd6-4d2a-af61-260c4e0f75c1	85c822b6-420c-42e8-bb2c-ba88d52aaae9	Leopard	I guess I and 9 need to be turned over then since consonants are not an issue.	Non-probing-deliberation	Reasoning	complete_solution
161b61ab-4829-4237-84ee-63a2078b55d8	85c822b6-420c-42e8-bb2c-ba88d52aaae9	Cat	I agree, you do need to check 9	Non-probing-deliberation	Solution	partial_solution
f84b6f55-0747-41fa-987c-eac8b263e7bf	85c822b6-420c-42e8-bb2c-ba88d52aaae9	Leopard	Ok, I think I'm less confused now that we talked it over. I would've screwed it all up turning over the F for no reason, lol	Non-probing-deliberation	Reasoning	
9e1d0049-dd11-4c2e-be5d-757e47d37b76	85c822b6-420c-42e8-bb2c-ba88d52aaae9	Cat	For once chatting actually helped me. I think 9 and I now	Non-probing-deliberation	Solution	complete_solution
d0184b10-1b81-4c92-9961-9e4222b8a39d	85c822b6-420c-42e8-bb2c-ba88d52aaae9	Lion	Agreed.	Non-probing-deliberation	Agree	
26e4e77b-e453-46e1-b4c4-6b8999aee206	85c822b6-420c-42e8-bb2c-ba88d52aaae9	Leopard	Teamwork! I'm so glad we talked it out y'all.			
9262107b-b147-4897-8424-8cd1be34f9e0	85c822b6-420c-42e8-bb2c-ba88d52aaae9	Cat	Thank you both for actively chatting :)			
6c480483-87a3-4ad1-8896-42f5d52b320c	85c822b6-420c-42e8-bb2c-ba88d52aaae9	Leopard	This is kind of fun. Wish we'd done stuff like this in school, I would've paid more attention :)			
						
						
						
67db00f6-9881-4298-94b2-618f21a71938	137068ab-319c-4b53-90b5-1b6bb5036644	Zebra	hello			
7c64896f-3092-4dd2-be80-1104fa492be7	137068ab-319c-4b53-90b5-1b6bb5036644	Chipmunk	Hello. So to test the rule, I flipped 6 (even number) and A (vowel). Did you both do that same?	Non-probing-deliberation	Reasoning	complete_solution
087b7dab-57ce-41d3-bbb3-c99ea8c56c96	137068ab-319c-4b53-90b5-1b6bb5036644	Bee	hi all, yes 6 and A	Non-probing-deliberation	Solution	complete_solution
7c466beb-0ae4-460a-8e6c-795aac36ff9d	137068ab-319c-4b53-90b5-1b6bb5036644	Zebra	You also have to test either W or 3 to make sure	Non-probing-deliberation	Reasoning	
c43a19df-8901-422e-926b-c07baeab5aba	137068ab-319c-4b53-90b5-1b6bb5036644	Bee	does the game tell u if u are worng?			
bc7f6cd0-1524-4447-bc27-c391f356e007	137068ab-319c-4b53-90b5-1b6bb5036644	Zebra	I don't know actually			
8400d83b-a367-458c-8c30-e6f469eb4246	137068ab-319c-4b53-90b5-1b6bb5036644	Bee	do we all have to have the same answers?	Probing	Moderation	
d6aec931-4254-41c2-ad5c-1f11ac737882	137068ab-319c-4b53-90b5-1b6bb5036644	Zebra	W might have a vowel on the other side	Non-probing-deliberation	Reasoning	
9e42ac17-e673-4a15-8acb-07b8f5d56d6d	137068ab-319c-4b53-90b5-1b6bb5036644	Zebra	3 too	Non-probing-deliberation	Reasoning	
ae85990a-d39b-4f24-91c0-7d8840403422	137068ab-319c-4b53-90b5-1b6bb5036644	Zebra	I'm picking all 4	Non-probing-deliberation	Solution	complete_solution
5904e3d2-ff3e-4877-bf73-e2d566ccaf03	137068ab-319c-4b53-90b5-1b6bb5036644	Bee	well the rules say that all  cards below has a letter on one side and a number on the other so W cannot have a vowel	Non-probing-deliberation	Reasoning	
1da94d6c-d4ea-4fd9-856b-d179316faaf3	137068ab-319c-4b53-90b5-1b6bb5036644	Chipmunk	I rereading the instructions.			
64c83453-07e5-40df-9e6b-044faad7fe74	137068ab-319c-4b53-90b5-1b6bb5036644	Zebra	so 6, 3, and A	Probing	Solution	solution_summary
f4969df7-abb0-4908-b592-a96c0ca1bb62	137068ab-319c-4b53-90b5-1b6bb5036644	Bee	3 cannot satisty one rule	Non-probing-deliberation	Reasoning	
dc0826f0-2bdf-4ef4-b481-08f60a1d3de8	137068ab-319c-4b53-90b5-1b6bb5036644	Bee	vowels on one side have an even number	Non-probing-deliberation	Solution	
0b4a5240-6f2d-4649-8d15-58c87511864d	137068ab-319c-4b53-90b5-1b6bb5036644	Zebra	But we have to see if there's a vowel on the other side...	Non-probing-deliberation	Reasoning	
0d20cb92-8614-4016-bc66-663986c3e425	137068ab-319c-4b53-90b5-1b6bb5036644	Chipmunk	@bee, correct	Non-probing-deliberation	Agree	specific_addressee
89b8d629-5ba9-41d2-9c72-790bdadd045b	137068ab-319c-4b53-90b5-1b6bb5036644	Bee	so 3 is an odd	Non-probing-deliberation	Reasoning	
6ae5e6f6-a90c-477a-bfbf-b18e81acf136	137068ab-319c-4b53-90b5-1b6bb5036644	Bee	so 6/A right?	Probing	Solution	solution_summary
be84f434-848f-4e54-8d6e-757cf1dc0219	137068ab-319c-4b53-90b5-1b6bb5036644	Zebra	Dude. You don't know what's on the other side. We have to see if the rule is correct	Non-probing-deliberation	Reasoning	
b56c4a76-0068-4f65-bd39-af4e813a92d0	137068ab-319c-4b53-90b5-1b6bb5036644	Bee	do we all have to agree on the same?	Probing	Moderation	
cc47ce03-7c31-400d-8e5e-94d07d4b89a5	137068ab-319c-4b53-90b5-1b6bb5036644	Zebra	If there's a vowel on the other side of the 3, then the rule isn't correct	Non-probing-deliberation	Reasoning	
9d77683e-269a-4c08-97fa-9bdd51f0aa76	137068ab-319c-4b53-90b5-1b6bb5036644	Chipmunk	No need to select 3, it's an odd number.	Non-probing-deliberation	Reasoning	
bbf91b99-848e-41ed-a887-205c4266691f	137068ab-319c-4b53-90b5-1b6bb5036644	Bee	OK :)	Non-probing-deliberation	Agree	
03d0daa3-266f-4852-8760-268229cf6fe9	137068ab-319c-4b53-90b5-1b6bb5036644	Chipmunk	@zebra, I understand what you are saying now.	Non-probing-deliberation	Agree	specific_addressee
af92117f-23eb-41d9-875d-47228803f497	137068ab-319c-4b53-90b5-1b6bb5036644	Zebra	50 seconds left. I'm picking 6 3 and A	Non-probing-deliberation	Solution	complete_solution
c34bccc9-b432-464f-a6e8-a7904f26d584	137068ab-319c-4b53-90b5-1b6bb5036644	Chipmunk	So, we need to select all four to see if the rule is correct or not.	Non-probing-deliberation	Reasoning	complete_solution
76483c75-abf5-46f0-b1e4-4330ae406d3b	137068ab-319c-4b53-90b5-1b6bb5036644	Zebra	not W.	Non-probing-deliberation	Solution	
bc84c08d-f159-4485-97fb-0c5b9833395f	137068ab-319c-4b53-90b5-1b6bb5036644	Chipmunk	Got it!	Non-probing-deliberation	Agree	
						
						
						
b6cf3667-ef58-49ef-a52f-25b5d0bf999d	7001e718-2e02-4d58-9cc3-39c79329fef1	Bat	Hi guys!			
aed22d62-444c-49a6-946a-9204949a6f91	7001e718-2e02-4d58-9cc3-39c79329fef1	Llama	HI everyone, I'm the moderator of the chat. Please start your discussion of the answers now!			
57859fdf-b506-4191-99ef-a3c5d2d8af2d	7001e718-2e02-4d58-9cc3-39c79329fef1	Narwhal	hello			
cc6f8016-79fb-43bd-9a82-dbd637820e23	7001e718-2e02-4d58-9cc3-39c79329fef1	Llama	Once you have all decided please state your final answer like so: FINAL ANSWER...			
0d41df86-ef40-4ac7-943d-b8bbbc9a34e7	7001e718-2e02-4d58-9cc3-39c79329fef1	Bat	So I picked card with number 7 and card with letter G	Non-probing-deliberation	Solution	complete_solution
634f47b7-a106-4acc-ae71-6bf10cae9cd0	7001e718-2e02-4d58-9cc3-39c79329fef1	Narwhal	I basically thought that you have to prove the rule is right by turning over a vowel to see if it had an even number, and an odd number to see if it had a vowel (because id it does the rule is wrong)	Non-probing-deliberation	Reasoning	complete_solution
33c3b873-803b-4926-800e-5080eb48ec33	7001e718-2e02-4d58-9cc3-39c79329fef1	Narwhal	I picked 7 and I	Non-probing-deliberation	Solution	complete_solution
e08ed97d-7de5-42f9-9c79-64f587d91532	7001e718-2e02-4d58-9cc3-39c79329fef1	Bat	But the rule that we need to check is that: Each of the 4 cards below has a letter on one side and a number on the other.""	Non-probing-deliberation	Solution	
1516cce3-98e7-4645-a7f8-1c676ea98135	7001e718-2e02-4d58-9cc3-39c79329fef1	Narwhal	My rule was 'Each letter with a vowel on one side has a even number on the other'	Non-probing-deliberation	Solution	
4a7c136e-1f1a-403c-a9ec-5ff525cca461	7001e718-2e02-4d58-9cc3-39c79329fef1	Bat	Ohh wait so this is the rule... haha			
b246cd52-3a5e-4bce-afc4-465c01b50a28	7001e718-2e02-4d58-9cc3-39c79329fef1	Narwhal	so we had different rules?			
7e2e9515-eeda-4227-b567-df3393bb3ecd	7001e718-2e02-4d58-9cc3-39c79329fef1	Llama	The rule you are testing is: All cards with vowels on one side have an even number on the other			
7834c08a-0667-44e1-b6b6-1104ceaedd08	7001e718-2e02-4d58-9cc3-39c79329fef1	Bat	No we have the same thing			
2a284e9d-265f-45b9-8395-4c229a055eea	7001e718-2e02-4d58-9cc3-39c79329fef1	Narwhal	oh okay aha			
402d05e9-8d2b-4659-a147-87d732bdbeaa	7001e718-2e02-4d58-9cc3-39c79329fef1	Bat	So which card we are selecting?	Probing	Moderation	
54b26a27-70d0-4d4f-a1f9-e02878b745e6	7001e718-2e02-4d58-9cc3-39c79329fef1	Narwhal	I think 7 and I but I'm not certain	Non-probing-deliberation	Solution	complete_solution
d81dde53-f60d-48aa-a36f-27d5abdd32e2	7001e718-2e02-4d58-9cc3-39c79329fef1	Narwhal	just because they'd be no point turning over the G as it's not a vowel, and same with the 8 coz if you yurn it over and it's not a vowel that doesn't prove the rule	Non-probing-deliberation	Reasoning	
7667a8a5-39c0-48a8-9981-6a04eb4ea3ad	7001e718-2e02-4d58-9cc3-39c79329fef1	Narwhal	coz the rule doesn't say that constinants cant have even numbers either	Non-probing-deliberation	Reasoning	
14e125fc-15e9-43d2-94d7-161d64150c0c	7001e718-2e02-4d58-9cc3-39c79329fef1	Narwhal	I don't know if I'm making any sense aha			
7897a72a-0ffe-47e7-9fa3-7b1c31522e44	7001e718-2e02-4d58-9cc3-39c79329fef1	Bat	I think turning 8 or I is the same think...	Non-probing-deliberation	Reasoning	
76d6bdd3-0b99-488c-acbb-460393c90cd7	7001e718-2e02-4d58-9cc3-39c79329fef1	Bat	Because I is vowel and 8 is even number	Non-probing-deliberation	Reasoning	
0ce63c19-01dc-4eca-b06d-67b76aac641a	7001e718-2e02-4d58-9cc3-39c79329fef1	Narwhal	but the rule only says vowels have to have an even number, not that even numbers have to have vowels	Non-probing-deliberation	Reasoning	
5c94354e-ef77-46b7-9d5e-0a0d79605e15	7001e718-2e02-4d58-9cc3-39c79329fef1	Narwhal	so the 8 could have a letter F on the other side and that doesn't disprove the rule	Non-probing-deliberation	Reasoning	
1b576de3-ab09-4d17-aa47-0da3ca25d38d	7001e718-2e02-4d58-9cc3-39c79329fef1	Bat	You smart ass... ahah			
be56d8bc-1855-402c-bada-a038054171f0	7001e718-2e02-4d58-9cc3-39c79329fef1	Bat	yes u are right	Non-probing-deliberation	Agree	
d972d28b-0bc1-400a-beba-af58e6387c12	7001e718-2e02-4d58-9cc3-39c79329fef1	Bat	So lets go for 7 and I	Non-probing-deliberation	Solution	complete_solution, solution_summary
714372b3-4d80-4dd7-a630-b6cd9dfd018c	7001e718-2e02-4d58-9cc3-39c79329fef1	Narwhal	ahaha thanks			
432c46f0-bcc2-4a1d-9aec-775ee67e2ef0	7001e718-2e02-4d58-9cc3-39c79329fef1	Narwhal	okie dokie	Non-probing-deliberation	Agree	
9e9cd7e9-e514-4790-b060-a2432eef2e6a	7001e718-2e02-4d58-9cc3-39c79329fef1	Llama	Have you come to a conclusion?			
b29796ee-d974-4f23-9404-7caabc44503b	7001e718-2e02-4d58-9cc3-39c79329fef1	Narwhal	yes I think so			
d1e78e29-04de-4968-9ad2-412051f8799a	7001e718-2e02-4d58-9cc3-39c79329fef1	Bat	Yes			
4333b7cd-5a7f-4fcb-aa70-82838cb5a99d	7001e718-2e02-4d58-9cc3-39c79329fef1	Llama	Please state FINAL ANSWER followed by your anwser			
dfa54a3e-aee3-4036-b7b1-39ec12bc7501	7001e718-2e02-4d58-9cc3-39c79329fef1	Bat	can we submit it?			
767887f9-b247-40d9-96a1-cc4bc7149480	7001e718-2e02-4d58-9cc3-39c79329fef1	Narwhal	FINAL ANSWER 7 and I			
68206fdf-e4dc-4638-81a6-43c5383c5691	7001e718-2e02-4d58-9cc3-39c79329fef1	Bat	FINAL ANSWER 7 and I			
94191c87-9a77-49f1-80d7-802522f2b7f6	7001e718-2e02-4d58-9cc3-39c79329fef1	Llama	Thank you for completing the study!! Please fill in the following debreif form (will only take 2 mins) if you have any problems please email one of the experiemnters!			
268bec81-30a6-44f9-b414-f02992d11dbc	7001e718-2e02-4d58-9cc3-39c79329fef1	Llama	https://sheffieldpsychology.eu.qualtrics.com/jfe/form/SV_9traMfD2E8kEd6J			
d86284f2-fee0-4093-a59d-0cf7f64d0977	7001e718-2e02-4d58-9cc3-39c79329fef1	Llama	(you may have to copy and paste into the search bar)			
						
						
						
